{
  "$schema": "../fighter.schema.json",
  "id": "padyatri-yuvraj",
  "name": "Padyatri Yuvraj",
  "faction": "Gathbandhan Alliance",
  "color": "#27407a",
  "palette": { "secondary": "#f2f2f2", "accent": "#d23a3a", "skin": "#dca584", "dark": "#3a3a42" },
  "look": {
    "proportions": {
      "legLength": 72, "torsoHeight": 46, "neck": 4, "headWidth": 31, "headHeight": 30,
      "shoulderWidth": 52, "waistWidth": 40, "hipWidth": 16,
      "upperArm": 29, "foreArm": 27, "armWidth": 11, "legWidth": 13, "footLength": 22
    },
    "hair": { "style": "messy", "color": "#4a2f1e" },
    "face": { "eyes": "round", "brows": { "thickness": 3.5, "color": "#2a1a12", "tilt": -2 }, "mouth": "flat" },
    "base": { "top": "secondary", "sleeveColor": "secondary", "pants": "#c9b283", "shoes": "#2a2a31", "sleeves": "short" },
    "outfit": [
      { "type": "beard", "style": "full", "color": "#52453b" }
    ],
    "poses": {
      "idle": { "lean": 4, "headTilt": -4, "frontArm": [25, 123], "backArm": [26, 119], "frontLeg": [20, 11], "backLeg": [-16, 10], "bobAmp": 2, "bobSpeed": 1.8, "sway": 3 },
      "victory": { "lean": -6, "headTilt": -8, "frontArm": [160, 15], "backArm": [-20, 100], "bobAmp": 5, "bobSpeed": 2, "sway": 6 },
      "special": {
        "startup": { "lean": -6, "headTilt": -12, "frontArm": [168, 8], "backArm": [-14, 30], "frontLeg": [16, 8], "backLeg": [-18, 8] },
        "active": { "lean": 14, "headTilt": 4, "frontArm": [92, 4], "backArm": [-30, 40], "frontLeg": [30, 20], "backLeg": [-28, 10] }
      }
    }
  },
  "svg": {
    "id": "padyatri_yuvraj_v3",
    "scale": 0.364,
    "pivots": { "shoulderBack": [102, 178], "shoulderFront": [156, 180], "hipBack": [108, 300], "hipFront": [148, 300], "neck": [128, 150], "footBack": [56, 498], "footFront": [214, 498], "elbowBack": [130, 236], "elbowFront": [180, 232] },
    "propFollows": "arm-front",
    "anim": {
      "restAngles": { "armBack": 25.8, "armFront": 24.8, "legBack": -19, "legFront": 16.6, "armBackLower": 145.1, "armFrontLower": 148 },
      "elbowWeight": 0.5, "restElbow": 99, "extendElbow": 120, "reach": 40,
      "kneeWeight": 0.3, "leanScale": 1, "headScale": 1, "bobScale": 1,
      "cloth": { "pivot": [104, 170], "windSwing": 6, "swing": 2, "speed": 2.3, "lag": 10, "breeze": 0 }
    }
  },
  "stats": { "maxHealth": 112, "walkSpeed": 190, "jumpVelocity": 800 },
  "body": { "width": 74, "height": 152 },
  "taunts": ["I'll walk 4,000 km just to hit you.", "Slow and steady wins. Eventually. Probably."],
  "winQuote": "I walked here. Slowly. You're welcome.",
  "moves": {
    "light": {
      "startupMs": 90,
      "activeMs": 80,
      "recoveryMs": 180,
      "damage": 7,
      "hitstunMs": 260,
      "blockstunMs": 160,
      "knockback": 230,
      "hitbox": { "x": 34, "y": 112, "width": 60, "height": 32 }
    },
    "heavy": {
      "startupMs": 260,
      "activeMs": 110,
      "recoveryMs": 420,
      "damage": 16,
      "hitstunMs": 470,
      "blockstunMs": 260,
      "knockback": 540,
      "hitbox": { "x": 34, "y": 62, "width": 90, "height": 44 }
    }
  },
  "special": {
    "type": "projectile",
    "name": "Constitution Shockwave",
    "label": "Ground wave",
    "description": "Raises the Constitution; its glowing pages release a ground shockwave that floors whoever it reaches. Jump it or block it.",
    "fx": "constitution",
    "impact": "BOOM!",
    "cost": 60,
    "cooldownMs": 5500,
    "damage": 20,
    "startupMs": 720,
    "activeMs": 60,
    "recoveryMs": 600,
    "hitstunMs": 1100,
    "blockstunMs": 320,
    "knockback": 640,
    "knockdown": true,
    "speed": 560,
    "width": 90,
    "height": 70,
    "y": 70,
    "spawnX": 60,
    "lifetimeMs": 1900
  }
}
